<?xml version="1.0" encoding="UTF-8"?>
<dataroot xmlns:od="urn:schemas-microsoft-com:officedata" xmlns:xsi="http://www.w3.org/2001/XMLSchema-instance"  xsi:noNamespaceSchemaLocation="ClassType.xsd" generated="2017-11-18T14:05:29">
<ClassType>
<ID>1</ID>
<Type>Assassin</Type>
<GivenID>0</GivenID>
</ClassType>
<ClassType>
<ID>2</ID>
<Type>Berserker</Type>
<GivenID>1</GivenID>
</ClassType>
<ClassType>
<ID>3</ID>
<Type>BeastMaster</Type>
<GivenID>2</GivenID>
</ClassType>
<ClassType>
<ID>4</ID>
<Type>Commander</Type>
<GivenID>3</GivenID>
</ClassType>
<ClassType>
<ID>5</ID>
<Type>Destroyer</Type>
<GivenID>4</GivenID>
</ClassType>
<ClassType>
<ID>6</ID>
<Type>Tracer</Type>
<GivenID>5</GivenID>
</ClassType>
<ClassType>
<ID>7</ID>
<Type>Tanker</Type>
<GivenID>6</GivenID>
</ClassType>
<ClassType>
<ID>8</ID>
<Type>Archer</Type>
<GivenID>7</GivenID>
</ClassType>
<ClassType>
<ID>9</ID>
<Type>Trickster</Type>
<GivenID>8</GivenID>
</ClassType>
<ClassType>
<ID>10</ID>
<Type>Mystic</Type>
<GivenID>9</GivenID>
</ClassType>
</dataroot>
